{
  "id": "avatar.style.anime.creature",
  "category": "Presence/Avatar",
  "kind": "lora",
  "sdx_version": "1.5",
  "base_model": "runwayml/stable-diffusion-v1-5",
  "lora_rank": 16,
  "default_weight": 1.0,
  "negatives": "photo, text, watermark",
  "size_mb": 0.1,
  "created_at": "2025-10-11T22:40:19.342992",
  "training_config": {
    "resolution": 640,
    "max_train_steps": 3000,
    "learning_rate": 0.0001,
    "batch_size": 1
  },
  "metadata": {
    "description": "Anime creature style LoRA for organic, fantastical character design",
    "tags": [
      "style",
      "anime",
      "creature",
      "fantasy",
      "organic"
    ],
    "author": "Talent Factory",
    "license": "Private"
  }
}